<xs:schema attributeFormDefault="unqualified" elementFormDefault="qualified" xmlns:xs="http://www.w3.org/2001/XMLSchema">
  <xs:element name="Cuisines">
    <xs:complexType>
      <xs:sequence>
        <xs:element name="Cuisine" maxOccurs="unbounded" minOccurs="0">
          <xs:complexType>
            <xs:sequence>
              <xs:element type="xs:string" name="Type"/>
              <xs:element type="xs:string" name="Dish"/>
            </xs:sequence>
            <xs:attribute type="xs:byte" name="id" use="optional"/>
          </xs:complexType>
        </xs:element>
      </xs:sequence>
    </xs:complexType>
  </xs:element>
</xs:schema>